{
  "$schema": "./node_modules/@voxx/core/voxx.schema.json",
  "site": {
    "title": "Acme Changelog",
    "description": "Release notes for Acme.",
    "url": "https://example.com",
    "locale": "en-US"
  },
  "content": {
    "type": "changelog",
    "dir": "content",
    "basePath": "/changelog",
    "drafts": false
  },
  "theme": {
    "preset": "shadcn",
    "css": null,
    "codeTheme": "github-light github-dark"
  },
  "seo": {
    "openGraph": true,
    "twitter": null,
    "jsonLd": true,
    "defaultImage": null
  }
}
